{
  "schema_version": "1.0",
  "query": "сохранит ли ЦБ ключевую ставку до конца года",
  "hits": [
    {
      "doc_id": "bank:demo-key-rate-review",
      "kind": "bank_analytics",
      "title": "Ключевая ставка ЦБ РФ: ставка без изменения, риторика стала жёстче",
      "source": "Центр макроэкономического анализа Альфа-Банка",
      "url": null,
      "document": "Ключевая ставка ЦБ РФ: ставка без изменения, риторика стала жёстче (11.09.2026), стр. 1, абзац 6",
      "published_at": "2026-09-11T15:00:00Z",
      "fragment_id": "s1-6",
      "locator": "стр. 1, абзац 6",
      "quote": "Синтетическая цитата: мы ожидаем сохранения ставки на текущем уровне до конца года.",
      "score": 0.92,
      "bm25": 14.37,
      "rerank": 0.95
    },
    {
      "doc_id": "news:demo-cbr-rate",
      "kind": "news",
      "title": "Аналитики ждут паузы в снижении ставки",
      "source": "Деловая газета",
      "url": "https://example.org/news/rate-pause",
      "document": "Деловая газета: Аналитики ждут паузы в снижении ставки (20.10.2026), абзац 2",
      "published_at": "2026-10-20T09:00:00Z",
      "fragment_id": "p2",
      "locator": "абзац 2",
      "quote": "Синтетическая цитата: опрошенные экономисты ожидают, что регулятор сохранит ставку.",
      "score": 0.71,
      "bm25": 9.8,
      "rerank": 0.75
    }
  ],
  "reranked": true,
  "model": "glm-5.3-flash",
  "searched": 640,
  "warnings": []
}
